{
  "experiment_id": "iris_qkernel_v0_1_6",
  "dataset": "iris",
  "version": "v0.1.6",
  "classical_baseline": {
    "model": "RBF SVM",
    "framework": "scikit-learn",
    "accuracy": 0.88
  },
  "quantum_model": {
    "model": "Qiskit Quantum Kernel SVM",
    "framework": "qiskit",
    "accuracy": 0.6
  },
  "delta_vs_classical": -0.28,
  "claim_status": "quantum_underperforms",
  "limitations": [
    "Small dataset",
    "Binary subset only",
    "Does not generalize to broader QML claims"
  ],
  "notes": "Classical baseline outperformed quantum model."
}
